{"artifact_sha256":"b3a2b4db54816dd6f40171c221947d942ca63f3e9883f76de8455ad66037f4b9","authority_effect":"none","capture_dispatch_authorized":false,"context":{"actor":"HKati","architecture":"x86_64","bootstrap_python_sha256":"a15ccdaf07655a8667a3687b13171486c9a265d92273ba3ad820fbb64d2cfecc","event":"workflow_dispatch","kernel":"6.17.0-1022-azure","libc":["glibc","2.39"],"origin":"owner_dispatched_github_native_diagnostic","os":"ubuntu-24.04","python":"3.11.16","repository":"HKati/pulse-release-gates-0.1","run_attempt":1,"run_id":"37362661448","runner_image":"20260927.320.1","source_commit":"60af89b6c90f767b283b80888f2b114fce94c4cf","workflow":".github/workflows/q2_reference_acquisition_v0.yml"},"diagnostic_call_limit":1,"error_code":null,"evidence":[{"path":"bootstrap-pip.log","sha256":"5b29d4e1940d362a1beaf9c42f15f1c921c2a55cd582c15764adcce2ba00b11d","size":124},{"path":"bootstrap.json","sha256":"226e3ef11fcfbf9688ee7a8ad2aa89d8f8068c503c44200db16acdbc0302bcf4","size":92415},{"path":"decodecheck-sandbox.json","sha256":"a02be49e746a2c5be3f360602a08267e7dd44f3f1c0f4378e50a1cc1d70e6191","size":8506},{"path":"decodecheck.log","sha256":"e3b0c44298fc1c149afbf4c8996fb92427ae41e4649b934ca495991b7852b855","size":0},{"path":"diagnostic-check.json","sha256":"d77c2dce6e1e15d831c3f4abd1729bac01275fbfd6c494aa166f73e8546f7d8f","size":651},{"path":"generation-intent.json","sha256":"55eceda8aec78aaf04867dd6ca6e614fa9eadb8481a08838d04a3d79ec61f7a3","size":133},{"path":"generation-start.json","sha256":"fb23d6016466614eae7e7652fb693d70a93c099a77d0174cd1f69368942e91ef","size":341},{"path":"input-check.json","sha256":"c327935a36cc21322740fda4cbf4745e8281767abd77ce00ce423c191eb8ea07","size":2918},{"path":"input-check.log","sha256":"7883599946b99355590a1c856c055b4beef1914e686e5720220441b7c797eb5e","size":55},{"path":"installation.json","sha256":"f29fa7bbe1ecbe7cd2c5fdb4294086a5ba83b1d0cfcb9a1a913f0d5cd0a1a89a","size":3426025},{"path":"installcheck-sandbox.json","sha256":"21d03c29e75588605a69f62046367712c95e38ef0001c8565338ad0438be3fd2","size":8513},{"path":"installcheck.log","sha256":"e3b0c44298fc1c149afbf4c8996fb92427ae41e4649b934ca495991b7852b855","size":0},{"path":"installer-sandbox.json","sha256":"da171dbebb0f7526777b83a0b595ffab273a4c68d7dcd803f1de4be5878d0f64","size":8488},{"path":"installer.log","sha256":"e3b0c44298fc1c149afbf4c8996fb92427ae41e4649b934ca495991b7852b855","size":0},{"path":"model-ready.json","sha256":"1587045fe9c092c047a92a7d3f3da0250b3636d9cf1d6dc3d18612ab22ecddd9","size":2372},{"path":"occurrence.json","sha256":"169589e72362dfa5e3c922d68422cb4ba84051dce0bfb2a7da8519393bfaa8bb","size":8702},{"path":"original-continuation.utf8","sha256":"8ce9e3c4e082c980ddeb06aa2d0722fffe066898561fbe95eb234d96f8aff7ee","size":43},{"path":"original-response.json","sha256":"d128d8d3ec0cc77202c5dae888a19fb03b6c2d01e3dc09141bb49f7299356321","size":2660},{"path":"pip-install.log","sha256":"88c158549eef7c21cb7f402aabfa949a5e3ddd5b881118ee6e736199785f2e7e","size":9060},{"path":"pip-report.json","sha256":"4909e31099e7b08b314c827052ae8d8d9e5599616a596a64549c91d0531c08ae","size":395616},{"path":"prelaunch.json","sha256":"52df2892856b20aa07ad0eeec980616e9f4be0602880498b9b2aef688e964dc9","size":3965},{"path":"source/.github/workflows/q2_reference_acquisition_v0.yml","sha256":"b3bae6363047fb23ee41e8003adc98496c35c7b9e46f45e2e2f33807c792d293","size":9335},{"path":"source/PULSE_safe_pack_v0/examples/q2_reference_field_extraction_v0/requests.json","sha256":"fa0412c6a702e220e5d0c8b09a5e854fe35ac89d4801977eeee0f2a6e5cae997","size":100468},{"path":"source/PULSE_safe_pack_v0/examples/q2_runtime_preparation_v0/run_37148637546/preparation.json","sha256":"832b3626e846c96e5d65052ea54c966aabf0ed5f3976ecc5d3b4a3ced006ef4f","size":29638},{"path":"source/PULSE_safe_pack_v0/examples/q2_runtime_preparation_v0/run_37148637546/q2-runtime-preparation-check.json","sha256":"8676b29834f376b44f08f96b19d60d1ab79a9f565167aabd25513cf8694037e3","size":653},{"path":"source/PULSE_safe_pack_v0/examples/q2_runtime_preparation_v0/run_37148637546/q2_reference_model_files_v0.json","sha256":"b91289806a62957e2613f21afa950d4bf48b917074fde16d3e94681764d74078","size":2465},{"path":"source/PULSE_safe_pack_v0/examples/q2_runtime_preparation_v0/run_37148637546/requirements-q2-reference-v0.lock","sha256":"60cec54ed62df95b299cdeaf386afc7ed0b72f4fb7ec466cf82905bb40168d0f","size":2986},{"path":"source/PULSE_safe_pack_v0/profiles/q2_reference_diagnostic_v0.json","sha256":"f9f7fec1dbb5970788df21bd5bc9c51467b9f3d6d5752802528fb5795cd7768b","size":876},{"path":"source/PULSE_safe_pack_v0/profiles/q2_reference_model_files_v0.json","sha256":"7df82db50a623326e12c333b69e5ef621c169bdddc663425fd8ed8e4be307de2","size":4454},{"path":"source/PULSE_safe_pack_v0/profiles/q2_reference_subject_v0.json","sha256":"e81a9dd0a5080d84dae8c4bbfc843b46510f580e74254c1aed0dddbe76375f3e","size":10284},{"path":"source/PULSE_safe_pack_v0/requirements-q2-reference-v0.lock","sha256":"b5933b3e6867357ab906fe87b92eed9450a30687f3617ac9e3bd9501ae28a8de","size":2986},{"path":"source/PULSE_safe_pack_v0/tools/check_q2_reference_capture_v0.py","sha256":"beb0e3d3d9de451fb862090cb92267bc62191386528f1735feb2b3e4b04e02be","size":23846},{"path":"source/PULSE_safe_pack_v0/tools/check_q2_reference_qualification_v0.py","sha256":"25a09b19baae853344e2e656c261267dda8514c484f8477e59d1b60897bf34cc","size":43658},{"path":"source/PULSE_safe_pack_v0/tools/qualify_q2_reference_runtime_v0.py","sha256":"69f154ff403782e086dd5ddebec25fae93929ef23b49ffc445718635a166c95e","size":54107},{"path":"source/PULSE_safe_pack_v0/tools/run_q2_reference_subject_v0.py","sha256":"7cdc86ce4b48ef296c8fe8d60a6e2d5d6f412ae240789ee8ce8af4fea4af717d","size":13106},{"path":"source/schemas/metrics/q2_reference_qualification_v0.schema.json","sha256":"79ad8518de0a1f013da498b6c6988a4fb017af65fd2c97efdf9be5f2e6acdbdf","size":5225},{"path":"worker-sandbox.json","sha256":"7b2e030e768a3f074325c0aeb953e2b5169526f697e7652d275d3553949b596e","size":8471},{"path":"worker.log","sha256":"aaa09aab886de1f83917ae74ece127a8014d80045ef3ee7b773ad46683d03832","size":50}],"limitations":["GitHub host and bootstrap CPython/pip remain trusted","one diagnostic does not establish 150-call capture viability","no score, acquisition completeness, release admission or malicious-platform proof"],"native_runtime_qualified":true,"phase_end_ns":152125168403,"phase_start_ns":73698616800,"preparation_run_id":"37148637546","preparation_source_commit":"77fc5d51896568db50a2a87f650711a65db8fe8c","production_gate_eligible":false,"record_type":"q2_reference_qualification_v0","scored_call_count":0,"status":"qualified"}
